{
  "$schema": "https://json-schema.org/draft/2020-12/schema",
  "$id": "https://susegad-ui.local/registry/schema.json",
  "title": "Susegad UI registry item manifest",
  "description": "One registry.json per package, scene, component, recipe or adapter folder; a folder that holds a second item names it <name>.registry.json. It tells the CLI which files to copy into a builder's project. Paths in files, docs and prompt are relative to the folder the manifest sits in. Repo-rooted paths that start with packages/ are still accepted while older manifests move over, and the build prints a note when it sees one. The index the build writes (registry/registry.json) is described by $defs.index.",
  "$ref": "#/$defs/manifest",
  "$defs": {
    "name": {
      "description": "Lowercase kebab-case. Scenes are scene-<name>, for example scene-kolam.",
      "type": "string",
      "pattern": "^[a-z][a-z0-9]*(-[a-z0-9]+)*$",
      "x-hint": "should be lowercase kebab-case, like scene-kolam"
    },
    "type": {
      "type": "string",
      "enum": ["package", "scene", "surface", "component", "recipe", "adapter"]
    },
    "register": {
      "type": "string",
      "enum": ["quiet", "warm", "playful"]
    },
    "stability": {
      "description": "experimental: may change or move without notice. beta: the contract is settling; breaking it gets a changelog entry. stable: covered by the semver rules in the roadmap.",
      "type": "string",
      "enum": ["experimental", "beta", "stable"]
    },
    "useForTag": {
      "description": "A short, honest tag for where this piece fits well: for example hero, loader, empty-state, 404, divider, section-break, background or story. Not a closed list; add one only where the piece's own description already supports it.",
      "type": "string",
      "pattern": "^[a-z][a-z0-9]*(-[a-z0-9]+)*$",
      "x-hint": "should be a short kebab-case tag, like hero or section-break"
    },
    "relPath": {
      "description": "A forward-slash path inside the repo. No leading slash, no backslashes, no .. segments.",
      "type": "string",
      "minLength": 1,
      "pattern": "^(?!/)(?![A-Za-z]:)(?!.*\\\\)(?!.*(^|/)\\.\\.(/|$)).+$",
      "x-hint": "should be a forward-slash path inside the repo, with no leading slash, no drive letter and no .."
    },
    "version": {
      "type": "string",
      "pattern": "^\\d+\\.\\d+\\.\\d+(-[0-9A-Za-z.-]+)?$",
      "x-hint": "should be a version like 0.1.0"
    },
    "hash": {
      "description": "sha256 of the content in hex, with CRLF line endings read as LF so a checkout on Windows hashes the same.",
      "type": "string",
      "pattern": "^sha256-[0-9a-f]{64}$"
    },
    "budget": {
      "type": "object",
      "properties": {
        "jsBytes": { "description": "Unminified source bytes of this item's own .js and .mjs files.", "type": "integer", "minimum": 0 },
        "frameMs": { "description": "Milliseconds per frame when animated.", "type": "number", "exclusiveMinimum": 0 },
        "firstSightBytes": { "description": "A scape only (decision 0020, amended): the most code (comments stripped) its first sight may load before the finished still is on screen, at most 65536.", "type": "integer", "minimum": 0 },
        "reason": { "description": "Why this item's budget differs from the default for its type (see docs/decisions/0001-architecture.md, Budgets).", "type": "string", "minLength": 1 }
      },
      "additionalProperties": false
    },
    "manifest": {
      "type": "object",
      "required": ["name", "type", "files"],
      "properties": {
        "$schema": { "type": "string" },
        "name": { "$ref": "#/$defs/name" },
        "type": { "$ref": "#/$defs/type" },
        "title": { "type": "string", "minLength": 1 },
        "description": { "type": "string", "minLength": 1 },
        "version": { "$ref": "#/$defs/version" },
        "stability": { "$ref": "#/$defs/stability" },
        "stabilityReason": { "description": "Required for beta or stable: one line saying why.", "type": "string", "minLength": 1 },
        "motif": {
          "description": "For a piece drawn from a cultural tradition: where it comes from, how everyday or ceremonial it is, and one honest sentence about it. The gate batch lints this field.",
          "type": "object",
          "required": ["origin", "tier", "gloss"],
          "properties": {
            "origin": { "type": "string", "minLength": 1 },
            "tier": { "type": "string", "minLength": 1 },
            "gloss": { "type": "string", "minLength": 1 },
            "clientLed": {
              "description": "Sacred motifs only: true means the client asked for the motif and leads how it is used. The motif lint requires it on every sacred motif.",
              "type": "boolean"
            }
          },
          "additionalProperties": false
        },
        "useFor": {
          "type": "array",
          "uniqueItems": true,
          "items": { "$ref": "#/$defs/useForTag" }
        },
        "files": {
          "type": "array",
          "minItems": 1,
          "uniqueItems": true,
          "items": { "$ref": "#/$defs/relPath" }
        },
        "dependencies": {
          "type": "array",
          "uniqueItems": true,
          "items": { "$ref": "#/$defs/name" }
        },
        "npmDependencies": {
          "description": "npm packages the CLI adds to the consumer's package.json, name to exact version, matching the library's own package.json (decision 0017).",
          "type": "object",
          "additionalProperties": { "$ref": "#/$defs/version" }
        },
        "registers": {
          "type": "array",
          "uniqueItems": true,
          "items": { "$ref": "#/$defs/register" }
        },
        "budget": { "$ref": "#/$defs/budget" },
        "docs": { "$ref": "#/$defs/relPath" },
        "prompt": { "$ref": "#/$defs/relPath" },
        "tier": { "description": "\"scape\": a scene budgeted on its first sight rather than its total (decision 0020).", "type": "string", "enum": ["scape"] },
        "entry": {
          "description": "A scape only: the files its first sight loads from. What they import statically counts; a dynamic import() is the seam to the rest.",
          "type": "array",
          "minItems": 1,
          "uniqueItems": true,
          "items": { "$ref": "#/$defs/relPath" }
        }
      },
      "additionalProperties": false
    },
    "indexFile": {
      "type": "object",
      "required": ["path", "bytes", "hash"],
      "properties": {
        "path": { "description": "Repo-rooted, always under packages/.", "$ref": "#/$defs/relPath" },
        "bytes": { "type": "integer", "minimum": 0 },
        "hash": { "$ref": "#/$defs/hash" }
      },
      "additionalProperties": false
    },
    "indexItem": {
      "type": "object",
      "required": ["name", "type", "title", "description", "version", "stability", "manifest", "files", "dependencies", "registers", "bytes", "jsBytes", "codeBytes", "hash"],
      "properties": {
        "name": { "$ref": "#/$defs/name" },
        "type": { "$ref": "#/$defs/type" },
        "title": { "type": "string" },
        "description": { "type": "string" },
        "version": { "$ref": "#/$defs/version" },
        "stability": { "$ref": "#/$defs/stability" },
        "stabilityReason": { "type": "string", "minLength": 1 },
        "motif": {
          "description": "For a piece drawn from a cultural tradition: where it comes from, how everyday or ceremonial it is, and one honest sentence about it. The gate batch lints this field.",
          "type": "object",
          "required": ["origin", "tier", "gloss"],
          "properties": {
            "origin": { "type": "string", "minLength": 1 },
            "tier": { "type": "string", "minLength": 1 },
            "gloss": { "type": "string", "minLength": 1 },
            "clientLed": {
              "description": "Sacred motifs only: true means the client asked for the motif and leads how it is used. The motif lint requires it on every sacred motif.",
              "type": "boolean"
            }
          },
          "additionalProperties": false
        },
        "useFor": {
          "type": "array",
          "uniqueItems": true,
          "items": { "$ref": "#/$defs/useForTag" }
        },
        "manifest": { "$ref": "#/$defs/relPath" },
        "files": { "type": "array", "minItems": 1, "items": { "$ref": "#/$defs/indexFile" } },
        "dependencies": { "type": "array", "uniqueItems": true, "items": { "$ref": "#/$defs/name" } },
        "npmDependencies": { "type": "object", "additionalProperties": { "$ref": "#/$defs/version" } },
        "registers": { "type": "array", "uniqueItems": true, "items": { "$ref": "#/$defs/register" } },
        "budget": { "$ref": "#/$defs/budget" },
        "docs": { "$ref": "#/$defs/relPath" },
        "prompt": { "$ref": "#/$defs/relPath" },
        "bytes": { "type": "integer", "minimum": 0 },
        "jsBytes": { "type": "integer", "minimum": 0 },
        "codeBytes": { "description": "jsBytes with comments and blank lines taken out (decision 0002).", "type": "integer", "minimum": 0 },
        "tier": { "type": "string", "enum": ["scape"] },
        "entry": { "type": "array", "items": { "$ref": "#/$defs/relPath" } },
        "firstSightBytes": { "description": "A scape only: the code bytes (comments stripped, as codeBytes) of its own files that its entry reaches by static imports (decision 0020, amended).", "type": "integer", "minimum": 0 },
        "hash": { "$ref": "#/$defs/hash" }
      },
      "additionalProperties": false
    },
    "index": {
      "description": "registry/registry.json, written by registry/build.mjs. Sorted and free of timestamps, so the same sources always give the same bytes.",
      "type": "object",
      "required": ["name", "format", "base", "items"],
      "properties": {
        "name": { "type": "string" },
        "format": { "const": 1 },
        "base": { "description": "Where file paths are rooted, relative to the index file's folder.", "type": "string" },
        "items": { "type": "array", "items": { "$ref": "#/$defs/indexItem" } }
      },
      "additionalProperties": false
    }
  }
}
