{
  "name": "scene-kolam",
  "type": "scene",
  "stability": "experimental",
  "useFor": ["loader","hero"],
  "title": "Kolam",
  "description": "One unbroken line of rice flour around a grid of dots, found with the mirror-curve method. Hairline ink in quiet, drawn once at a hand's pace in warm, poured by your hand with rangoli colour and ants in playful. The progress attribute draws it exactly that far.",
  "version": "0.1.0",
  "files": ["index.js", "model.js", "render.js", "meta.js", "kolam.prompt.md"],
  "dependencies": ["core", "engine", "tokens"],
  "registers": ["quiet", "warm", "playful"],
  "prompt": "kolam.prompt.md",
  "budget": { "jsBytes": 40960 },
  "motif": {
    "origin": "tamil nadu",
    "tier": "regional",
    "gloss": "The kolam, the threshold drawing laid fresh each morning in Tamil Nadu and elsewhere in South India; here drawn in rice-flour lines by code."
  }
}
