{
  "name": "tokens",
  "type": "package",
  "stability": "beta",
  "stabilityReason": "Colour, type, space, motion and the register cascade: every other piece is built on it, and it has carried real pages since the soft launch.",
  "title": "Tokens",
  "version": "0.1.0",
  "description": "Colour (OKLCH, light and dark, Susegad, Casa and Azulejo palettes), type for Latin, Devanagari and Kannada, space, motion, sound names and the register, as CSS custom properties with a JS mirror. Self-hosted OFL fonts split by script. Includes palette-from-photo.",
  "files": [
    "tokens.css",
    "fonts.css",
    "tokens.js",
    "color.js",
    "fonts/README.md",
    "fonts/castoro/OFL.txt",
    "fonts/castoro/castoro-400-700-italic-latin.woff2",
    "fonts/castoro/castoro-400-700-latin.woff2",
    "fonts/fallbacks.json",
    "fonts/kalam/OFL.txt",
    "fonts/kalam/kalam-300-devanagari.woff2",
    "fonts/kalam/kalam-300-latin.woff2",
    "fonts/kalam/kalam-400-devanagari.woff2",
    "fonts/kalam/kalam-400-latin.woff2",
    "fonts/mukta/OFL.txt",
    "fonts/mukta/mukta-400-devanagari.woff2",
    "fonts/mukta/mukta-400-latin.woff2",
    "fonts/mukta/mukta-500-devanagari.woff2",
    "fonts/mukta/mukta-500-latin.woff2",
    "fonts/mukta/mukta-600-devanagari.woff2",
    "fonts/mukta/mukta-600-latin.woff2",
    "fonts/notosanskannada/OFL.txt",
    "fonts/notosanskannada/noto-sans-kannada-400-600-kannada.woff2",
    "fonts/tirodevanagarimarathi/OFL.txt",
    "fonts/tirodevanagarimarathi/tiro-devanagari-marathi-400-devanagari.woff2",
    "fonts/tirokannada/OFL.txt",
    "fonts/tirokannada/tiro-kannada-400-kannada.woff2"
  ],
  "dependencies": [],
  "motif": {
    "origin": "none",
    "tier": "everyday",
    "gloss": "No cultural motif; shared infrastructure, nothing drawn from a tradition."
  }
}
