{
  "name": "form",
  "type": "component",
  "stability": "experimental",
  "title": "Form",
  "description": "A native form the browser validates, which says what happens when you send it. Adds a field note to every field, summarises problems and focuses the first, and follows an sg-submit promise (or posts itself with fetch): Sending only while work is pending, then Sent or why it could not send, in one polite voice. Quiet is words only; warm and playful draw a Loader and a Stamp, and a failure is also a Toast. Without JavaScript it validates and submits natively.",
  "version": "0.1.0",
  "files": [
    "form.js",
    "form.core.js",
    "form.css",
    "skins/quiet.js",
    "skins/warm.js",
    "skins/playful.js",
    "form.prompt.md",
    "form.docs.md"
  ],
  "dependencies": [
    "field-note",
    "loader",
    "stamp",
    "toast",
    "core-component",
    "core",
    "tokens",
    "sound"
  ],
  "registers": [
    "quiet",
    "warm",
    "playful"
  ],
  "prompt": "form.prompt.md",
  "docs": "form.docs.md",
  "budget": {
    "jsBytes": 36864,
    "reason": "Decision 0005: 12 KB of behaviour plus 8 KB for each of three skins. Today 13510 bytes: behaviour (form.js + form.core.js) 10.8 KB, skins quiet 0.3 KB, warm 1.9 KB, playful 0.3 KB."
  },
  "motif": {
    "origin": "none",
    "tier": "everyday",
    "gloss": "No cultural motif; shared infrastructure, nothing drawn from a tradition."
  }
}
